[
  {
    "schemaVersion": "runner.content-card.v1",
    "cardType": "pregame",
    "artifact": {
      "schemaVersion": "runner.data.v1",
      "artifactId": "fixture-nfl-schedule",
      "kind": "content",
      "runnerEventId": "FIXTURE:NFL:AWAY:HOME",
      "sport": "NFL",
      "league": "NFL",
      "source": "Synthetic example authored in this repository; no provider retrieval.",
      "provider": "runner-fixture",
      "retrievedAt": "2026-09-26T17:45:00Z",
      "eventStartTime": null,
      "transformVersion": "runner-operations-v1",
      "freshness": "FIXTURE",
      "confidence": "UNKNOWN",
      "redistribution": "PUBLIC",
      "intelligence": {
        "classification": "UNKNOWN",
        "modelProbability": null,
        "marketProbability": null,
        "fairPrice": null,
        "executablePrice": null,
        "edge": null
      },
      "payload": {
        "note": "Synthetic schedule shell. Missing values remain UNKNOWN. No verified Runner model output.",
        "homeTeam": "Example Home",
        "awayTeam": "Example Away",
        "status": "UNKNOWN"
      }
    },
    "sections": {
      "Current State": "NFL pregame shell; FIXTURE.",
      "Verified Evidence": "Synthetic example authored in this repository; no provider retrieval. Event: FIXTURE:NFL:AWAY:HOME.",
      "Runner Analysis": "UNKNOWN. Complete this shell only after reviewing verified event evidence. No proprietary model result is asserted.",
      "Market Comparison": "Model probability, market probability, fair price, executable price and edge are distinct fields. Null means UNKNOWN; verify price, timestamp, fees and liquidity before comparison.",
      "Countercase / Invalidation": "Invalidate after a material injury, lineup, weather, score, pace or market change, conflicting sources, or expired evidence.",
      "Confidence / Uncertainty": "UNKNOWN; incomplete inputs suppress conclusions.",
      "Source Freshness": "FIXTURE; receipt/authorship 2026-09-26T17:45:00Z; provider runner-fixture; transform runner-operations-v1.",
      "Next Action": "Verify kickoff, injuries, lineups, weather, opening/current prices, contract rules and pregame baseline. Resolve missing fields, then request editorial review before publication."
    }
  },
  {
    "schemaVersion": "runner.content-card.v1",
    "cardType": "halftime",
    "artifact": {
      "schemaVersion": "runner.data.v1",
      "artifactId": "fixture-nfl-schedule",
      "kind": "content",
      "runnerEventId": "FIXTURE:NFL:AWAY:HOME",
      "sport": "NFL",
      "league": "NFL",
      "source": "Synthetic example authored in this repository; no provider retrieval.",
      "provider": "runner-fixture",
      "retrievedAt": "2026-09-26T17:45:00Z",
      "eventStartTime": null,
      "transformVersion": "runner-operations-v1",
      "freshness": "FIXTURE",
      "confidence": "UNKNOWN",
      "redistribution": "PUBLIC",
      "intelligence": {
        "classification": "UNKNOWN",
        "modelProbability": null,
        "marketProbability": null,
        "fairPrice": null,
        "executablePrice": null,
        "edge": null
      },
      "payload": {
        "note": "Synthetic schedule shell. Missing values remain UNKNOWN. No verified Runner model output.",
        "homeTeam": "Example Home",
        "awayTeam": "Example Away",
        "status": "UNKNOWN"
      }
    },
    "sections": {
      "Current State": "NFL halftime shell; FIXTURE.",
      "Verified Evidence": "Synthetic example authored in this repository; no provider retrieval. Event: FIXTURE:NFL:AWAY:HOME.",
      "Runner Analysis": "UNKNOWN. Complete this shell only after reviewing verified event evidence. No proprietary model result is asserted.",
      "Market Comparison": "Model probability, market probability, fair price, executable price and edge are distinct fields. Null means UNKNOWN; verify price, timestamp, fees and liquidity before comparison.",
      "Countercase / Invalidation": "Invalidate after a material injury, lineup, weather, score, pace or market change, conflicting sources, or expired evidence.",
      "Confidence / Uncertainty": "UNKNOWN; incomplete inputs suppress conclusions.",
      "Source Freshness": "FIXTURE; receipt/authorship 2026-09-26T17:45:00Z; provider runner-fixture; transform runner-operations-v1.",
      "Next Action": "Verify halftime score, drives, pace, possession, injuries, second-half receiver and fresh market quotes; compare with the pregame baseline. Resolve missing fields, then request editorial review before publication."
    }
  },
  {
    "schemaVersion": "runner.content-card.v1",
    "cardType": "game-total",
    "artifact": {
      "schemaVersion": "runner.data.v1",
      "artifactId": "fixture-nfl-schedule",
      "kind": "content",
      "runnerEventId": "FIXTURE:NFL:AWAY:HOME",
      "sport": "NFL",
      "league": "NFL",
      "source": "Synthetic example authored in this repository; no provider retrieval.",
      "provider": "runner-fixture",
      "retrievedAt": "2026-09-26T17:45:00Z",
      "eventStartTime": null,
      "transformVersion": "runner-operations-v1",
      "freshness": "FIXTURE",
      "confidence": "UNKNOWN",
      "redistribution": "PUBLIC",
      "intelligence": {
        "classification": "UNKNOWN",
        "modelProbability": null,
        "marketProbability": null,
        "fairPrice": null,
        "executablePrice": null,
        "edge": null
      },
      "payload": {
        "note": "Synthetic schedule shell. Missing values remain UNKNOWN. No verified Runner model output.",
        "homeTeam": "Example Home",
        "awayTeam": "Example Away",
        "status": "UNKNOWN"
      }
    },
    "sections": {
      "Current State": "NFL game-total shell; FIXTURE.",
      "Verified Evidence": "Synthetic example authored in this repository; no provider retrieval. Event: FIXTURE:NFL:AWAY:HOME.",
      "Runner Analysis": "UNKNOWN. Complete this shell only after reviewing verified event evidence. No proprietary model result is asserted.",
      "Market Comparison": "Model probability, market probability, fair price, executable price and edge are distinct fields. Null means UNKNOWN; verify price, timestamp, fees and liquidity before comparison.",
      "Countercase / Invalidation": "Invalidate after a material injury, lineup, weather, score, pace or market change, conflicting sources, or expired evidence.",
      "Confidence / Uncertainty": "UNKNOWN; incomplete inputs suppress conclusions.",
      "Source Freshness": "FIXTURE; receipt/authorship 2026-09-26T17:45:00Z; provider runner-fixture; transform runner-operations-v1.",
      "Next Action": "Verify combined score, clock, drives, points per drive, remaining-possession assumptions and game-total line/price. Resolve missing fields, then request editorial review before publication."
    }
  },
  {
    "schemaVersion": "runner.content-card.v1",
    "cardType": "team-total",
    "artifact": {
      "schemaVersion": "runner.data.v1",
      "artifactId": "fixture-nfl-schedule",
      "kind": "content",
      "runnerEventId": "FIXTURE:NFL:AWAY:HOME",
      "sport": "NFL",
      "league": "NFL",
      "source": "Synthetic example authored in this repository; no provider retrieval.",
      "provider": "runner-fixture",
      "retrievedAt": "2026-09-26T17:45:00Z",
      "eventStartTime": null,
      "transformVersion": "runner-operations-v1",
      "freshness": "FIXTURE",
      "confidence": "UNKNOWN",
      "redistribution": "PUBLIC",
      "intelligence": {
        "classification": "UNKNOWN",
        "modelProbability": null,
        "marketProbability": null,
        "fairPrice": null,
        "executablePrice": null,
        "edge": null
      },
      "payload": {
        "note": "Synthetic schedule shell. Missing values remain UNKNOWN. No verified Runner model output.",
        "homeTeam": "Example Home",
        "awayTeam": "Example Away",
        "status": "UNKNOWN"
      }
    },
    "sections": {
      "Current State": "NFL team-total shell; FIXTURE.",
      "Verified Evidence": "Synthetic example authored in this repository; no provider retrieval. Event: FIXTURE:NFL:AWAY:HOME.",
      "Runner Analysis": "UNKNOWN. Complete this shell only after reviewing verified event evidence. No proprietary model result is asserted.",
      "Market Comparison": "Model probability, market probability, fair price, executable price and edge are distinct fields. Null means UNKNOWN; verify price, timestamp, fees and liquidity before comparison.",
      "Countercase / Invalidation": "Invalidate after a material injury, lineup, weather, score, pace or market change, conflicting sources, or expired evidence.",
      "Confidence / Uncertainty": "UNKNOWN; incomplete inputs suppress conclusions.",
      "Source Freshness": "FIXTURE; receipt/authorship 2026-09-26T17:45:00Z; provider runner-fixture; transform runner-operations-v1.",
      "Next Action": "Verify the selected team, points, possessions, opponent defense, remaining drives and team-total line/price. Resolve missing fields, then request editorial review before publication."
    }
  },
  {
    "schemaVersion": "runner.content-card.v1",
    "cardType": "rushing-prop",
    "artifact": {
      "schemaVersion": "runner.data.v1",
      "artifactId": "fixture-nfl-schedule",
      "kind": "content",
      "runnerEventId": "FIXTURE:NFL:AWAY:HOME",
      "sport": "NFL",
      "league": "NFL",
      "source": "Synthetic example authored in this repository; no provider retrieval.",
      "provider": "runner-fixture",
      "retrievedAt": "2026-09-26T17:45:00Z",
      "eventStartTime": null,
      "transformVersion": "runner-operations-v1",
      "freshness": "FIXTURE",
      "confidence": "UNKNOWN",
      "redistribution": "PUBLIC",
      "intelligence": {
        "classification": "UNKNOWN",
        "modelProbability": null,
        "marketProbability": null,
        "fairPrice": null,
        "executablePrice": null,
        "edge": null
      },